Albany Park,9/17/2025 8:15pm,09-17 Albany Park-4717 Monticello Ave,9/17/2025 8:15pm,Wednesday,8AM-4PM,,"Caller reported ICE. Reported address of 4717 Monticello but states Haugan Elementary (4540 N Hamlin - close but a few blocks away) two vehicles, green truck, six agents. Response team reported on Monticello address",4717 Monticello Ave,"Rumors, ICE Sighting",,,"Chicago NWS, Albany Park",,checked,Jo Ann,,,FSN,,
Elgin - Home Depot,9/17/2025 7:54pm,09-17 Elgin - Home Depot-945 Randall Road,9/17/2025 7:54pm,Wednesday,8AM-4PM,,Caller reports that there are currently 2 ice vehicles and 7-8 masked agents actively detaining people at Home Depot. There were 4 vehicles earlier (team lead notes the call was from a +266 number which is odd),945 Randall Road,"ICE Sighting, Rumors",,,,,,Jo Ann,,,FSN,,
Brighton Park,9/17/2025 7:50pm,09-17 Brighton Park-47th and Western,9/17/2025 7:50pm,Wednesday,8AM-4PM,,"Reporting arrest at Home Depot. initial report says a Subaru, Jeep, and a gray Ford Explorer.
Team reports 5 people detained - a couple and 3 individuals. Truck was left there. 3 dodge chargers and silver Ford",47th and Western,ICE Sighting,,,Chicago SWS,5,checked,Jo Ann,,"Dodge Chargers
Silver Ford
White Subaru",External,,
Midway,9/17/2025 7:42pm,09-17 Midway-Cermak and Kenneth,9/17/2025 7:42pm,Wednesday,8AM-4PM,,"Parking lot behind Cermak Produce. Caller saw about 20 agents dressed in green, accompanied by sheriff cars and unmarked cars. They were not interacting with anyone. (Seems like it might simply be a sheriff operation-still worth passing on?)
Pilsen RRT saw them earlier. We had a member go over to the lot they had been at who arrived around 10:40am (the lot just past cermak and kostner). Several municipal plated police cars and sheriff's cars were still parked there after that bigger group in green left. We believe it's police related, didn't find any other activity.",Cermak and Kenneth,FALSE,,,Pilsen,,checked,Jo Ann,,,FSN,,
Wicker Park/West town,9/17/2025 7:26pm,09-17 Wicker Park/West town-Wood and Haddon,9/17/2025 7:15pm,Wednesday,8AM-4PM,,"Caller reported seeing several large guys with unmarked cars/fatigues with no agency identifying info on. He approached them and asked if they were ICE. They said yes and then he asked again and they said no.
Second call came in at 2:07pm (someone from our network following up on this call) - reported that staff from Jesse Fuentes' office were currently warning neighbors that ICE was nearby in unmarked vehicles.",Wood and Haddon,Rumors,,,Chicago NWS,,checked,Jo Ann,,,FSN,,
Naperville,9/17/2025 7:22pm,09-17 Naperville-1020 W Bauer Road,9/17/2025 7:22pm,Wednesday,8AM-4PM,,Arresting landscapers around that area.,1020 W Bauer Road,Rumors,,,Chicago NWS,,,Jo Ann,,,FSN,,
Bensenville,9/17/2025 7:08pm,09-17 Bensenville-,9/17/2025 7:08pm,Wednesday,8AM-4PM,,"Facebook live video of ICE detaining an individual. Six unmarked vehicles. Several ICE officers. Looks to be in a parking lot of a strip mall - Dunkin Donuts and apartment complexes
White Jeep Cherokee pulled up on the side of the Nissan Rogue and hit it to prevent detainee from moving. Also, it appears there was a police officer there at some point. Has an actual badge and can see rank stripes on his arm. Uploading some stills from the video of what appears to be police. https://www.facebook.com/share/v/16tbenG98h/?mibextid=wwXIfr ",,ICE Sighting,,Pulling up cars,,1,,Jo Ann,,"Nissan Rogue (dark blue) - Illinois license plate FA 60936 - This is the detainees car
Jeep Cherokee (white) - Texas license plate - LMV 6490
Ford (possibly an Explorer) (dark blue or black) - Illinois license plate BD 48403
Ford Explorer (dark blue or black) - Texas license plate SJF 2237
White SUV - Texas license plate WPG 1788
Ford Explorer (metallic black) - Colorado license plate OFJ 966
Ford Explorer (dark blue) - Texas license plate LTV 3278",External,,
Elgin,9/17/2025 12:16pm,"09-16 Elgin-904 Chippewa Drive, Elgin, IL 60120",9/16/2025 11:56am,Tuesday,12AM-8AM,,"From Elgin this morning: home arrests made. From what we know: Agents including Border patrol claimed to Elgin PD that they have a warrant. Broke down the door to the home and made “three arrests.” 

Border patrol agents and armored vehicles were there. Agent tried antagonizing one of our members. 

They’re on the move now.

https://www.facebook.com/share/v/14JzLWcZmpb/?mibextid=wwXIfr

Border patrol helicopter has been circling around all morning

At 5:50 am today, a group of 40 or 50 men and 20 trucks broke the doors and took three people from a house in Elgin (904 Chippewa Drive ). There were helicopters and drones surrounding the house. One of the enforcement agents said they were border patrol and others were dressed in camouflage but all their clothes and vehicles were unmarked. One of the people arrested was the home owner. One person was a renter so they don't know much about him. The callers are going to continue looking for their A#s and are trying to locate the 3 people. 

Elgin team has been in contact with family members and neighbors.
","904 Chippewa Drive, Elgin, IL 60120","ICE Sighting, Home Raid",,Entering without consent,Elgin,3,,Ismael Cordová-Clough,,White Ford Expedition - plate unclear from video,External,,
Berwyn,9/16/2025 11:54pm,"09-16 Berwyn-6432 16th St, Berwyn, IL 60402",9/16/2025 11:54pm,Tuesday,4PM-12AM,,"FSN 
Possible ICE sighting in berwyn on 16th st and Ridgeland. They have the street blocked of and a helicopter hovering over that area. The caller said that there was a lot of police activity but did not specify if it was indeed ICE.

we think it is this https://www.cbsnews.com/amp/chicago/news/shooting-near-lincoln-middle-school-berwyn/

Alexa notes: Yes, this was related to the vice principal of the school being killed by her husband in her car, unfortunately - not ICE activity. ","6432 16th St, Berwyn, IL 60402","ICE Sighting, False",,,,,,Alexa Herrera,,,FSN,,
Chicago - Gage Park,9/16/2025 11:32pm,"09-18 Chicago - Gage Park-S Western Ave & W Garfield Blvd, Chicago, IL 60609",9/18/2025 11:32pm,Thursday,4PM-12AM,,"FSN:
Possible ICE sighting. On Western and 55th st. The caller said that her family member drove by and saw two agents possibly ICE wearing black vest walking at the park with some kids. This was about 15min ago.


SW responding, no confirmation","S Western Ave & W Garfield Blvd, Chicago, IL 60609","ICE Sighting, Rumors",,,,,,Alexa Herrera,,,FSN,,
Chicago - McKinley Park,9/16/2025 11:18pm,"09-16 Chicago - McKinley Park-3316 S Hamilton Ave, Chicago, IL 60608",9/16/2025 11:18pm,Tuesday,4PM-12AM,,"This is being shared on a chat - ppl are telling them to call into FSN

THERE IS POLICE AND ICE AT MY DOOR. They are looking for our neighbor! 3316 south Hamilton Chicago 60608

SW Responding

ppl are sharing their rights in the chat

A few people from BP team will be there in 15

","3316 S Hamilton Ave, Chicago, IL 60608","ICE Sighting, Home Raid, Rumors",,,"Chicago SWS, Bridgeport/Chinatown",,,Alexa Herrera,,,"RRT, External",,
Naperville,9/16/2025 10:58pm,09-16 Naperville-,9/16/2025 10:33pm,Tuesday,4PM-12AM,,"This recent post by Ismael Cordova was flagged by our team and alleges ice was in Naperville this morning and detained workers. But no more details are provided.

https://www.facebook.com/watch/?mibextid=wwXIfr&v=1136249277920355&rdid=RTb0ebIRlh238X2n

Aurora RRT was texted by representative but she didn't hear anything about ICE",,"ICE Sighting, Rumors",,,Aurora,,,Alexa Herrera,,grey ford explorer north carolina DLE-9953,External,,
Gurnee,9/16/2025 10:25pm,"09-16 Gurnee-I-94 / Grand Ave, Gurnee, IL 60031",9/16/2025 10:25pm,Tuesday,4PM-12AM,,FSN: caller reporting ice activity in gurney il on the tri state highway toward the discount tires ?? what looked to be an all black car and the gurney police detained 1 person brown color older gentleman very frail looking the caller did not have further details,"I-94 / Grand Ave, Gurnee, IL 60031","ICE Sighting, Rumors",,Pulling up cars,,,,Alexa Herrera,,,FSN,,
Chicago - Gage Park,9/16/2025 9:57pm,"09-16 Chicago - Gage Park-W 62nd St & S Fairfield Ave, Chicago, IL 60629",9/16/2025 9:00pm,Tuesday,8AM-4PM,,"FSN report 
Gage Park, Chicago, Illinois 
Intersection of s Fairfield Ave and w 62nd st
Shortly before 3 pm
Caller reported that parents at Fairfield Elementary had noticed a blue Toyota loitering at the intersection near the school. No license plate or description of the driver/passengers. Caller did not know of any interactions between driver/passengers and passersby.


SW responded, didn't see anything","W 62nd St & S Fairfield Ave, Chicago, IL 60629","Public Space Raid, ICE Sighting, Rumors",,,Chicago SWS,,,Alexa Herrera,,,FSN,,
Chicago - Lithuanian Plaza,9/16/2025 9:51pm,"09-16 Chicago - Lithuanian Plaza-6901 S Fairfield Ave, Chicago, IL 60629",9/16/2025 9:00pm,Tuesday,8AM-4PM,,"Está ice en la McKay school tenga cuidado alas mamás oh los papás que tenga sus niños en esa escuela están en una blue toyota

Hi, do you know if anyone called this in?
That's by the corner of my house
By 69th and Fairfield

A leader sent me this - asking if this has been reported to the hotline. She called but wasn't able to give that much details.","6901 S Fairfield Ave, Chicago, IL 60629","ICE Sighting, Rumors, Public Space Raid",,Pulling up cars,,,,Alexa Herrera,,blue toyota,External,,
Chicago - Tri Taylor,9/16/2025 9:45pm,"09-16 Chicago - Tri Taylor-2378-2398 W Congress Pkwy, Chicago, IL 60612",9/16/2025 9:45pm,Tuesday,8AM-4PM,,fsn:caller just reported ice actvityb near litle village 2 ice agents in a black odyssy honda plat # FP249968 main street is Western and the car was heading westbound on congress agents were in jackets so signage was not available,"2378-2398 W Congress Pkwy, Chicago, IL 60612","ICE Sighting, Rumors",,,,,,Alexa Herrera,,black honda odyssey #FP249968,FSN,,
West Chicago,9/16/2025 9:38pm,09-16 West Chicago-,9/16/2025 9:38pm,Tuesday,8AM-4PM,,fsn: caller calling to report ice activity in west chi naigbors are aware that ice agents and or border patrol are walking around checking plates on cars in an apartment compelx calleer did not give me any more info on location she was sacred and hung up they are also in green tactical gear,,"ICE Sighting, Rumors",,,,,,Alexa Herrera,,,FSN,,
Northbrook,9/16/2025 9:22pm,"09-16 Northbrook-2855 Shermer Rd, Northbrook, IL 60062",9/16/2025 9:22pm,Tuesday,8AM-4PM,,"FSN: 2855 sherbet rd in Northbrook,il factory name is spring fill the employer was noticed that an ice agent in an all black car was waiting in the parking lot vest sinage EOR* and there were no markings on the car, the facility is notified and no one at the moment is being allowed inside

Evanston RRT, Skokie RRT responded, all clear, left KYR information at the business

*probably ""ERO""","2855 Shermer Rd, Northbrook, IL 60062","ICE Sighting, Rumors, Worksite Raid",,Pulling up cars,"Evanston, Skokie",,checked,Alexa Herrera,"Spring Fill Industries, LLC",,FSN,,
Hodgkins,9/16/2025 9:13pm,"09-16 Hodgkins-41°45'45.6""N 87°51'45.9""W",9/16/2025 9:13pm,Tuesday,8AM-4PM,,"FSN:caller reported chicago il, 55south 279 exist 4 agents maybe two cars 1 person in custody all black cars while caller was driving, he did not catch the plate number","41°45'45.6""N 87°51'45.9""W","ICE Sighting, Rumors",,Pulling up cars,,1,,Alexa Herrera,,,FSN,,
Chicago - Logan Square,9/16/2025 8:59pm,"09-16 Chicago - Logan Square-2524 N Linden Pl, Chicago, IL 60647",9/16/2025 8:15pm,Tuesday,8AM-4PM,,"FSN: Arrest reported 
2524 n Linden Place, Chicago, IL (Logan square)
2:15 PM today
Woman was detained by agents in front of her home. Her son called to make the report.


Thanks Ramona! We're connecting her to Congresswoman ramirez for follow up and connecting the family to mutual aid. They're looking for legal assistance","2524 N Linden Pl, Chicago, IL 60647","ICE Sighting, Home Raid",,,Chicago NWS,1,checked,Alexa Herrera,,,FSN,,
Chicago - Archer Heights,9/16/2025 8:51pm,"09-16 Chicago - Archer Heights-4343 S Pulaski Rd, Chicago, IL 60632",9/16/2025 8:45pm,Tuesday,8AM-4PM,,"?? SW responded, clear no ICE

""Not Confirmed: my friend that works in the area let me know that ICE is in the parking lot for Pete's on 43rd and Pulaski""","4343 S Pulaski Rd, Chicago, IL 60632","ICE Sighting, Rumors",,,,,,Alexa Herrera,,,External,,
Chicago - Downtown,9/16/2025 8:43pm,"09-16 Chicago - Downtown-Michigan Ave & E Randolph St, Chicago, IL 60601",9/16/2025 8:43pm,Tuesday,8AM-4PM,,"FSN: I just drove past Randolph and Michigan here in Chicago and there are these officers at the exit of the Metra station. I can't make out their uniforms, but they're not Chicago police.","Michigan Ave & E Randolph St, Chicago, IL 60601","ICE Sighting, Rumors",,,,,,Alexa Herrera,,,FSN,,
Chicago - South Chicago,9/16/2025 8:33pm,"09-16 Chicago - South Chicago-8333 S Houston Ave, Chicago, IL 60617",9/16/2025 6:30pm,Tuesday,8AM-4PM,,"Detainment at 12:30 today in Chicago
Ronald yobanny Moreno Méndez

This is his name. Witness says that he was just walking to get on his car and he got captured.

Venezuelan national



SE team: 1) One man taken from 83rd and Commercial Avenue in the mid afternoon 
","8333 S Houston Ave, Chicago, IL 60617","ICE Sighting, Public Space Raid",,,Other,1,checked,Alexa Herrera,,,"RRT, External",,
West Chicago,9/16/2025 8:32pm,"09-16 West Chicago-326 JOLIET ST, WEST CHICAGO, IL 60185",9/16/2025 8:40pm,Tuesday,8AM-4PM,,"FSN:West Chicago, IL. 
high school and middle school. West Chicago Community High School (326 JOLIET ST WEST CHICAGO, IL 60185).

 two trucks and a blue ford explorer with Nebraska license plate ALK998 surrounding the middle school which gets out at 2:40pm and HS gets out at 3:00pm students and parents are potential targets

St. Blue Ford Explorer -- Nebraska plates. those same agents were also there yesterday. May be targeting the Mexican food store nearby called (La India Market)","326 JOLIET ST, WEST CHICAGO, IL 60185","ICE Sighting, Public Space Raid, Rumors",,Pulling up cars,DuPage,,,Alexa Herrera,,two trucks and a blue ford explorer with Nebraska license plate ALK998,FSN,,
Chicago - Scottsdale,9/16/2025 8:32pm,"09-16 Chicago - Scottsdale-S Cicero Ave & W 79th St, Chicago, IL 60652",9/16/2025 5:30pm,Tuesday,8AM-4PM,,"@Bassem (SW Burbs) ?? and @Rania Salem - SW Suburbs - did you get any reports of something at 97th & Cicero about three hours ago? One of our team members is seeing a social media report on Nextdoor saying they saw ICE at a restaurant there, with workers seemingly running out a back door. No photos or detailed description.

","S Cicero Ave & W 79th St, Chicago, IL 60652","ICE Sighting, Rumors",,,SW Suburbs,,,Alexa Herrera,,,External,,
Chicago - Washington Heights,9/16/2025 8:29pm,09-15 Chicago - Washington Heights-South Avenue G and 107th,9/15/2025 8:29pm,Monday,8AM-4PM,,Tall navy blue vans seen in other posts. They have headlights on and engine idle. Heavily tinted windows with two possible officer inside.,South Avenue G and 107th,"ICE Sighting, Rumors",,,,,,Jim Poznak,,,FSN,,
Blue Island,9/16/2025 8:22pm,"09-16 Blue Island-Maple Ave & Union St, Blue Island, IL 60406",9/16/2025 8:22pm,Tuesday,8AM-4PM,,"FSN: Blue Island, IL
maple and union st (Kerr Middle School)
123rd and Gregory street (Paul revere school)
Caller reported “lots of cars” driving around, some with Texas plates, with drivers with hats and glasses. Did not note markings on cars, color, number, etc, but noted that they seemed to be driving slowly and observing pedestrians

Blue Island RRT responded, did not see anything, stayed parked until school dismissal

Spoke to the principal at Kerr, said she hasn’t seen anything suspicious but have limited the amount of time that kids and families are outside. Principal at Paul Revere Intermediate is a part of our team (it’s next to Paul Revere Primary) she’s going to review the cameras
","Maple Ave & Union St, Blue Island, IL 60406","ICE Sighting, Rumors",,,Blue Island,,,Alexa Herrera,,Lots of Texas license plates but no other info,FSN,,
Chicago - Albany Park,9/16/2025 8:16pm,"09-15 Chicago - Albany Park-4947 N Ridgeway Ave, Chicago, IL 60625",9/15/2025 7:56pm,Monday,8AM-4PM,,"at around 1:56pm but may be continuing; Mail lady is being followed by what looks like to be an officer. He is looking at her mail, on a radio, taking pictures of houses. He is talking with her and she answering questions","4947 N Ridgeway Ave, Chicago, IL 60625","Rumors, ICE Sighting",,,,,,Jim Poznak,,,RRT,,
West Chicago,9/16/2025 8:12pm,"09-16 West Chicago-E Brown St & Joliet St, West Chicago, IL 60185",9/16/2025 8:12pm,Tuesday,8AM-4PM,,"FSN: West Chicago, IL 
Brown st. + Joliet St.
 White Lincoln License plate AJA720 AND a Dark grey ford Explorer Midence plate ALK998","E Brown St & Joliet St, West Chicago, IL 60185","ICE Sighting, Rumors",,,,,,Alexa Herrera,,"White Lincoln License plate AJA720
Dark grey ford Explorer License plate ALK998",FSN,,
Chicago - East Side,9/16/2025 8:11pm,"09-16 Chicago - East Side-E 114th St & S Green Bay Ave, Chicago, IL 60617",9/16/2025 8:00pm,Tuesday,8AM-4PM,,"?? Report from 114th & Green Bay about 15 minutes ago

The young man was just walking when he was pulled over and ICE were trying to rough him up, and when someone asked ""hey what's going on"" ICE told him ""It's official business"". A few minutes later, I saw ICE put handcuffs on him and that's when I went and took his picture! God help us. 

ICE took the young man on 114th Green Bay



Was sent to Soren (BOTY-GAGE) RRT

RRT drove around and couldnt find them","E 114th St & S Green Bay Ave, Chicago, IL 60617","ICE Sighting, Public Space Raid",,Pulling up cars,,1,,Alexa Herrera,,"IL License Plate 685354
White Jeep SUV",External,,
Little Village,9/16/2025 8:07pm,09-15 Little Village-Cermak and Sacramento. One block west of Marshall,9/15/2025 8:07pm,Monday,8AM-4PM,,One person was taken. Worker at car parts shop on corner was witness and has video.,Cermak and Sacramento. One block west of Marshall,"ICE Sighting, Rumors",,,,,,Jim Poznak,,,RRT,,
Vernon Hills,9/16/2025 8:06pm,"09-16 Vernon Hills-700 N Milwaukee Ave, Vernon Hills, IL 60061",9/16/2025 8:00pm,Tuesday,8AM-4PM,,"FSN report from 5 minutes ago:

potential ICE sighting in Vernon Hills
calling from hawthorn hills square shopping center, near the Petsmart (E Townline Rd and N Milwaukee Ave)
Reported a grey SUV with 2 men sitting in front, both wearing green militaryish vests 
License plate began with CE, then 4 numbers","700 N Milwaukee Ave, Vernon Hills, IL 60061","ICE Sighting, Rumors",,,,,,Alexa Herrera,,"grey SUV, license plate beginning in ""CE""",FSN,,
Summit,9/16/2025 7:43pm,"09-16 Summit-Hwy 171 & I-55, Summit, IL 60501",9/16/2025 7:43pm,Tuesday,8AM-4PM,,"?? FSN:
Transcript [My name is Vincent Hicks and I'm on my way to work and I saw ICE detaining someone on highway 55 South right near the 280 to a* exit.]

Operators are calling back to determine where the caller was. Seems like the location doesn't exist based on the transcirpt.

*bad transcription of ""282A"" - exit number in Summit, IL

Follow up on this - confirmed that 4 people were taken - Guatemalan nationals on their way to work to Bolingbrook.","Hwy 171 & I-55, Summit, IL 60501",ICE Sighting,,,,4,checked,Alexa Herrera,,,FSN,,
Chicago - South Chicago,9/16/2025 7:33pm,"09-16 Chicago - South Chicago-E 82nd St & S Commercial Ave, Chicago, IL 60617",9/16/2025 7:33pm,Tuesday,8AM-4PM,,"FSN:
Another ICE sighting report by CTU staff. 6 agents on the corner of commercial Ave and 82 st. Still there. They can’t see how many cars but they’re standing by a bunch of trees in that corner. One car’s plate #5247522. They took a person earlier today on 112st.


Forwarded to SE","E 82nd St & S Commercial Ave, Chicago, IL 60617","ICE Sighting, Rumors",,,Other,,,Alexa Herrera,,unknown vehicle plate #5247522,FSN,,
Crest Hill,9/16/2025 7:32pm,"09-16 Crest Hill-17441 Weber Rd, Crest Hill, IL 60403",9/16/2025 7:32pm,Tuesday,8AM-4PM,,"FSN:
Suspicious ICE agents at Menard’s parking lot 17441 Weber rd, Cresthill IL. Red Ford plate #BD48432. He’s in a regular car but has blue uniform. Cresthill police car pulled up and spoke with him for a few minutes then drove off. He’s been there for a few minutes and he’s still there. No arrest and no photos.


Thank you. We have shared it with our team and will provide updates.


What time was the sighting? 

<no response>","17441 Weber Rd, Crest Hill, IL 60403","ICE Sighting, Rumors",,,SW Suburbs,,,Alexa Herrera,,Red Ford plate #BD48432,FSN,,
Little Village,9/16/2025 7:25pm,09-15 Little Village-27th and Springfield,9/15/2025 7:25pm,Monday,8AM-4PM,,Two blocks from Chase Bank. Officers in vehicle,27th and Springfield,Rumors,,,,,,Jim Poznak,,"red SUV, no plates",RRT,,
Chicago - Dan Ryan Woods,9/16/2025 6:44pm,"09-16 Chicago - Dan Ryan Woods-Chicago, IL 60620",9/16/2025 5:45pm,Tuesday,8AM-4PM,,"FYI: Received report of a sighting from an aldermanic staffer at Dan Ryan Woods. Below is the update. They are not at Dan Ryan. 

Today at about 11:45-12:15, an officers while on routine patrol at the Dan Ryan woods saw there were about 20-30 Ice agents. The officer inquired as to their business and it was relayed they were debriefing and then they left our property.


one of our folks called cook cty forest preserves, who said they’re aware and unhappy about it. their advice: 

Cook county forest preserves police are there 24/7 and can send ccfp police.

They are aware of the issue, and that is has occurred in dupage and Kane forests too.

1-708-771-1000

I would call 911 as well if you see any assemblage , it’s terrorizing our public lands","Chicago, IL 60620","ICE Sighting, Public Space Raid",,,Chicago SWS,,checked,Alexa Herrera,,,RRT,,
Warrenville,9/16/2025 6:27pm,"09-16 Warrenville-2S501 Illinois Rte 59, Warrenville, IL 60555",9/16/2025 2:00pm,Tuesday,8AM-4PM,,"?? FSN ICE sighting:

Warrenville Il
Country Beach Apartment 
And next to that is a market Toms, and the Hispanic bakery they are in the parking lot of all these places since 8am and they are still there. Looks like they are waiting because they are many schools . And that is where the school bus stop.

3 suv, white, brown and a grey one Johnson elementary","2S501 Illinois Rte 59, Warrenville, IL 60555","ICE Sighting, Rumors, False",,,DuPage,,checked,Alexa Herrera,,"Silver and white SUVs, white with dark windows",FSN,,
Chicago - West Englewood,9/16/2025 6:26pm,"09-16 Chicago - West Englewood-5501 S Ashland Ave, Chicago, IL 60636",9/16/2025 5:30pm,Tuesday,8AM-4PM,,"About an hour ago somebody reported ICE at the 76 gas station at Garfield & Ashland. One blurry photo on social media. They may have just been refueling, not clear whether it was an active operation. Probably lower priority than other stuff going on today, but can somebody on the SW/BotY team possibly check it out?

Sent to SWT","5501 S Ashland Ave, Chicago, IL 60636","ICE Sighting, Rumors",,,Chicago SWS,,,Alexa Herrera,,White SUV dark windows,External,,
Blue Island,9/16/2025 6:05pm,"09-16 Blue Island-12742 Western Ave, Blue Island, IL 60406",9/16/2025 6:05pm,Tuesday,8AM-4PM,,"fsn: 12742 Western Ave. Blue Island, IL 60406. there are ice agents detaing people coming out of the resturant there called El Ranchito Market, there","12742 Western Ave, Blue Island, IL 60406","ICE Sighting, Worksite Raid, Rumors",,,Blue Island,,,Alexa Herrera,El Ranchito Market,"white Dodge Durango, CU70331 License Plate",FSN,,
Chicago - Bucktown,9/16/2025 6:04pm,"09-16 Chicago - Bucktown-N Leavitt St & W Armitage Ave, Chicago, IL 60647",9/16/2025 6:04pm,Tuesday,8AM-4PM,,"FSN: caller reporting ICE activity on Armitage 1/2 block going east of Leavitt

White with green markings","N Leavitt St & W Armitage Ave, Chicago, IL 60647","Rumors, ICE Sighting",,,Chicago NWS,,,Alexa Herrera,,White with green markings,FSN,,
Melrose Park,9/16/2025 6:04pm,"09-16 Melrose Park-400 W North Ave, Melrose Park, IL 60160",9/16/2025 6:04pm,Tuesday,8AM-4PM,,"FSN: Melrose Park
North and 5th Avenue 
Agents were previously patrolling area on foot now sitting in their vehicles. 3 unmarked SUVs (Ford Explorers) parked on the street in front of the Panda Express. Out of state plates.
Panda Express:
400 W North Ave, Melrose Park, IL 60160

PASO Melrose Park RRT on site - we have a press conference outside and we have police escorts outside","400 W North Ave, Melrose Park, IL 60160","ICE Sighting, Rumors",,,"PASO, Melrose Park/Oak Park",,,Alexa Herrera,,3 unmarked SUVs (Ford Explorers),FSN,,
Warrenville,9/16/2025 5:44pm,"09-16 Warrenville-29W550 Country Ridge Dr, Warrenville, IL 60555",9/16/2025 5:40pm,Tuesday,8AM-4PM,,"FSN: ""Warrenville, IL
from a facebook post
29W550 Country Ridge Dr, Warrenville, IL 60555
Gray SUV with Massachussets plates and three masked men inside the vehicle stationed in front of Country Ridge Apartments. 

The post also shows three government issued trucks parked in front of a grocery store (Tom's Marketplace) across the street from the apartments.""

Original social media post could not be sourced.","29W550 Country Ridge Dr, Warrenville, IL 60555","ICE Sighting, Rumors",,,DuPage,,checked,Marlyn,,,FSN,,
Posen,9/16/2025 5:38pm,"09-16 Posen-Campbell Ave & 145th St., Posen, IL 60469",9/16/2025 5:35pm,Tuesday,8AM-4PM,,"FSN: ""Posen, IL
near 145th and Campbell 
two Black SUVs are patrolling; vehicles have been seen circling the area.""

Blue Island RRT: ""It's Posen PD.""","Campbell Ave & 145th St., Posen, IL 60469","ICE Sighting, False",,,Blue Island,,checked,Marlyn,,,FSN,,
