Chicago - Logan Square,9/9/2025 12:49am,09-08 Chicago - Logan Square-Logan Square blue line stop -  2620 N Milwaukee Ave,9/9/2025 12:30am,Monday,4PM-12AM,,"Reported directly on activity chat: ""My wife went by the Logan stop and there were tons of ice cars parked outside longman and eagle. She said 30 or so agents in masks, and someone said they were checking IDs in the train station. She came home in a panic. This was 20 minutes ago or so. I ran down there and am here— literally 15 minutes after that. And not one single agent. No cars. Nothing. However long they were here— they left quick."" Another person on the activity chat stated that the officers there were from the bureau of counterterrorism per the 35th ward office, and this was confirmed by RRT.",Logan Square blue line stop -  2620 N Milwaukee Ave,FALSE,,,Chicago SWS,,checked,Peter,,,External,,
Chicago - South Loop,9/9/2025 12:23am,09-08 Chicago - South Loop-Roosevelt Green/Orange Station - 1167 S. State St.,9/8/2025 7:43pm,Monday,8AM-4PM,,"External report of ""ice agents at roosevelt asking for identification - see photo",Roosevelt Green/Orange Station - 1167 S. State St.,Rumors,,,,,,Peter,,,External,,
Chicago - Chinatown,9/9/2025 12:10am,09-08 Chicago - Chinatown-Chinatown-Cermark CTA stop - 138 W Cermak Rd,9/9/2025 12:00am,Monday,4PM-12AM,,"Report from a member: ""Just spotted this Homeland Security vehicle and the black SUV directly behind it at the Chinatown/Cermak stop. 
6pm. They turned onto the expressway at Wentworth""",Chinatown-Cermark CTA stop - 138 W Cermak Rd,"Rumors, ICE Sighting",,,,,,Peter,,215OU - white SUV marked homeland security,External,,
Chicago - McKinley Park,9/9/2025 12:08am,09-08 Chicago - McKinley Park-36th and Western,9/9/2025 12:00am,Monday,4PM-12AM,,"FSN: ""36 AND WESTEN 2 BLOCKS APART AND 35TH AND WESTERN AND ARCHER RIGHT BY THE JEWL BLUE SUVS AND PEOPLE IN TACTICAL GEAR VESTS."" Later received another report from an external source from that same intersection from earlier in the day (see photo). SW team responded and confirmed CPD.",36th and Western,FALSE,,,Chicago SWS,,checked,Peter,,Blue SUVs,FSN,,
Chicago - West Town,9/8/2025 11:38pm,09-08 Chicago - West Town-Leavitt and Chicago,9/8/2025 11:20pm,Monday,4PM-12AM,,"Activity at this location reported by Elvia on chat, tip received from their boss and a post on social media. ""At Aprox 5:20 pm potential flash bangs used"" There does not appear to have been any confirmation by RRT teams.",Leavitt and Chicago,Rumors,,,,,,Peter,,Two black SUVs,External,,
Chicago - Little Village,9/8/2025 11:16pm,09-08 Chicago - Little Village-3112 West Cermack,9/8/2025 11:00pm,Monday,4PM-12AM,,"FSN: ""first floor ice agents are knocking on the front door in the apt building caller stating that they were non stop kicking the door almost knocking it to the ground that is how hard they kicked it."" Pilsen team responded and reported all clear, including confirming with an adjacent building.",3112 West Cermack,Rumors,,,Pilsen,,checked,Peter,,,FSN,,
Forest Park,9/8/2025 11:00pm,09-08 Forest Park-Forest Park Blue Line Station - 711 Des Plaines Ave,9/8/2025 10:58pm,Monday,4PM-12AM,,"FSN: caller got several ring alert notifications about ICE presence at Forest Park blue line station and the surrounding area, including a BP station at Des Plaines Ave & W 26th St. Cicero/Berwyn RRT responded and reported all clear.",Forest Park Blue Line Station - 711 Des Plaines Ave,Rumors,,,Cicero/Berwyn,,checked,Peter,,White Mercedes van,FSN,,
Chicago - Logan Square,9/8/2025 10:53pm,09-08 Chicago - Logan Square-Logan Square Blue Line Station - 2620 N Milwaukee Ave,9/8/2025 10:53pm,Monday,4PM-12AM,,"Originally reported on Logan Square community facebook page and then caller reported on FSN ""5 police and ICE agents present checking ID."" NWS and Palenque both responded  and confirmed it was CPD.",Logan Square Blue Line Station - 2620 N Milwaukee Ave,FALSE,,,Chicago NWS,,checked,Peter,,,FSN,,
Chicago - Pilsen,9/8/2025 3:00am,"09-08 Chicago - Pilsen-Eisenhower Expressway, 90/94 Wisconsin exit",9/8/2025 1:45am,Monday,4PM-12AM,,"ICE Sighting in Pilsen heading south on expressway, white dodge durango homeland security G62 A7467

2 ICE agents in the car 7:45PM getting off 90/94 exit west toward Wisconsin.

Heading south towrads Pilsen. Around 7:44PM on Eisenhower. They were getting off at the 90/94 Kennedy Expressway exit west toward Wisconsin. In the video/pics it is what looks like a white dodge durango with the words ""Homeland Security Police"" on it, license begins with G62 (which indicates US government vehicle) followed by A7467.  I looked up the number listed as well aon the car and it leads to a report suspicious activity link on Homeland Security's website.","Eisenhower Expressway, 90/94 Wisconsin exit",ICE Sighting,,,Pilsen,,,Cait,,,FSN,,
Chicago - Bucktown,9/8/2025 2:00am,"09-07 Chicago - Bucktown-North & Western, Dickerson",9/7/2025 10:00pm,Sunday,4PM-12AM,,"ICE Sighting in Bucktown -- Uhaul trucks 10 or more with what appears to be ICE agents were heading on North and Western (sic--possibly North on Western) each UHAUL was 4 per block starting on Dickson (sic--Dickens, likely) between 4PM and 6:45PM

Confirmed later from multiple NWS RRT nearby that it is a local company and no ICE activity currently or earlier today","North & Western, Dickerson","Rumors, False",,,Chicago NWS,,checked,Cait,,,FSN,,
Lake Forest,9/8/2025 12:51am,"09-07 Lake Forest-26325 Riverwood Blvd, Lake Forest",9/8/2025 12:00am,Sunday,4PM-12AM,,"The Residence Inn, Mettawa ICE agents are booking for several months northern suburbs November2025/February2026 at least 20 agents in the next few months driving white government trucks, White plates with blk lettering, the caller who works there stated she is very upset thta her management is hosting these federal agents and a lot of their employees who work there are undocmented and they now have not even showed up for work, Teresa wants to give additional information on where they are heading and other coworkers want to organize in ways they can help keep the area safe from future operations.","26325 Riverwood Blvd, Lake Forest","Rumors, Corporate Collaboration",,,,,,Cait,,,External,,
Chicago - Downtown,9/8/2025 12:00am,09-07 Chicago - Downtown-Roosevelt & Columbus,9/8/2025 12:00am,Sunday,4PM-12AM,,"5 Ice Agents at Roosevelt & Columbus near Taste of Chicago in the parking lot, pictures provided include 3 agents and 3 SUVs. Later confirmed to be state troopers.",Roosevelt & Columbus,FALSE,,,,,,Cait,,,FSN,,
Bolingbrook,9/7/2025 11:30pm,09-07 Bolingbrook-53rd & Lilycash Rd,9/7/2025 11:00pm,Sunday,4PM-12AM,,"FSN Caller reported ICE activity/ICE Sighting 22 minutes ago, 2 ICE agents in car waiting for folks to come outside.

ICE agents in a wine color care reported them in the Walgreens parking lot. SSIP-Will Co checked it out, saw the wine colored SUV, no one inside, nothing suspicious yet, parking lot is clear. Still investigating and scoping out the wider area.

Walgreens workers provided mismatching stories of ""law enforcement looking"" person with vest entering the store and stopping by photo department and didn't want to provide any more info. 

Caller did not provide any further details other than it might have been posted on FB and that they think they saw two agents in a wine color car in the parking lot what seemed to be CIE agents waiting for people coming out of the Walgreens store.

Confirmed later by video to be state troopers.",53rd & Lilycash Rd,FALSE,,,SSIP,,checked,Cait,,,FSN,,
Chicago - Brighton Park,9/7/2025 8:43pm,09-07 Chicago - Brighton Park-4170 S Archer Ave,9/7/2025 8:30pm,Sunday,8AM-4PM,,"2 Cars, white van/unmarked
3 Officers, wearing black shirts and green vests
Took woman at 2:30-2:40PM

RR team investigated twice but didn't see anything either time.",4170 S Archer Ave,"ICE Sighting, Public Space Raid, Rumors",,,,1,,Cait,,,FSN,,
Chicago - Archer Heights,9/7/2025 8:40pm,09-07 Chicago - Archer Heights-,9/7/2025 8:30pm,Sunday,8AM-4PM,,"Video at a BP gas station sent from Matt from New Life. Five agents kidnapping a youngish man in all black with an Addidas backpack, brought him into a black SUV. Same team from another abduction that day.

Also reported the presence of a far-right influencer who Matt says ""gave us problems earlier this year"" who appeared to be embedded with the ICE team and making videos, stating ""they're criminals, they have to go.""",,"ICE Sighting, Public Space Raid",,,SW Suburbs,1,checked,Cait,,,,,
Chicago - Gage Park,9/7/2025 7:19pm,09-07 Chicago - Gage Park-Pulaski & Archer,9/7/2025 7:00pm,Sunday,8AM-4PM,,"Black/Dark Blue subaru MO License Plate: TJ4 B2P

FB post states: Just tried to help this vendor on Pulaski and Archer as he was getting arrested by ICE and was threatened to get pepper sprayed if I got close

SW Chicago RRT responded and investigated but ICE was already gone.

Confirmed: local vendor kidnapped by ICE, these are the same agents that were seen by 75th and Pulaski earlier today, 9am (unconfirrmed if someone was kidnapped at 8AM sighting).

Brighton Park community alert post: The Southwest Rapid Response Team confirmed federal agents on Archer Ave and Pulaski road around 12:45PM today as well as the area surrounding Daley College on 75th and Pulaski Road. One perosn was detained outside of Honda City car dealership.

There were two unmasked ICE agents with ""POLICE FEDERAL AGENT"" vests in the following vehicle: Black Subaru Ascent Missouri License Plate TJ4 B2P",Pulaski & Archer,"ICE Sighting, Public Space Raid",,,SW Suburbs,1,checked,Cait,,,FSN,,
"Cicero, IL & Little Village, Chicago",9/7/2025 6:10pm,"09-07 Cicero, IL & Little Village, Chicago-Coculas restaurants",9/7/2025 2:17pm,Sunday,8AM-4PM,,"Someone posted that ICE presense is on Cermak at Coculas, we thought they were talking aout Cicero and no presense here but ppl are saying it might be the one on Pulaski--also a Coculas on Cermak and California.

LVSD team members checked out Cermak & California and La Cipotx checked out the one in Cicero and didn't see anything",Coculas restaurants,"Rumors, False",,,,,,Cait,,,,,
Chicago - Lakeview,9/6/2025 2:45am,"09-05 Chicago - Lakeview-3831 N Fremont St, Chicago, IL 60613",9/5/2025 8:15pm,Friday,8AM-4PM,,Screenshot from ICE Block app shared via social media,"3831 N Fremont St, Chicago, IL 60613","ICE Sighting, Rumors",,,,,,Paul,,,External,,
"Peru, IL",9/6/2025 12:00am,"09-05 Peru, IL-1100 Shooting Park Rd, Peru, IL 61354",9/5/2025 7:00pm,Friday,8AM-4PM,,"FSN: Ice sighting in Peru Illinois 
Casey’s on shooting park road. 5 unmarked cars and officers with vest that said nothing. This happened at 1pm","1100 Shooting Park Rd, Peru, IL 61354",ICE Sighting,,,,,,Paul,,,FSN,,
"Midlothian, IL",9/6/2025 12:00am,"09-05 Midlothian, IL-Hamlin Ave & 148th Pl Midlothian, IL 60445",9/6/2025 12:00am,Friday,4PM-12AM,,"Trying to confirm who was detained and the vehicles they were driving. Will let you know when we get the info
^ from Blue Island folks. They received the info too late and weren't able to respond on time so it's still unverified.
St. Augustine parish is having their kermes tomorrow. If BI team need support coordinating please let me know","Hamlin Ave & 148th Pl Midlothian, IL 60445",ICE Sighting,,,,,,Paul,,,External,,
"Waukegan, IL",9/5/2025 8:55pm,"09-05 Waukegan, IL-1700 N Lewis Ave, Waukegan, IL 60085",9/5/2025 8:55pm,Friday,8AM-4PM,,For data purposes: we received reports of ICE agents taking photos of licenses plates and detaining people at the Tony’s fresh market on Lewis Ave in Waukegan. We responded and Employees at the store said they had not heard or seen anything including a parking lot cart attendant. We gave KYR cards.,"1700 N Lewis Ave, Waukegan, IL 60085",ICE Sighting,,,,,,Paul,,,RRT,,
Chicago - Lower West Side,9/5/2025 8:16pm,09-05 Chicago - Lower West Side-17th and Damen,9/5/2025 7:45pm,Friday,8AM-4PM,,FSN: ICE sighting: 17th and Damen train yard. 4 vehicles gathering. Agents wearing ICE vests. 2 men wearing ICE vests got out of dark navy blue suburban truck and spoke to another black pick up truck. No visible arrests but appeared to be a meeting place. This sighting was approximately 30 minutes ago.,17th and Damen,ICE Sighting,,,,,,Paul,,,FSN,,
Chicago - Back of the Yards,9/5/2025 8:00pm,09-05 Chicago - Back of the Yards-43rd and Ashland,9/5/2025 8:00pm,Friday,8AM-4PM,,"FSN: Caller shared potential ICE Sighting with limited details as it was a quick observation while driving. 
Observation: 1 guy with sunglasses wearing a bulletproof vest; no organization labeled on uniform. Did not notice any vehicles around him. No noted interaction with individuals. 
Time: 40 minutes prior to call to hotline. 
Location: 43rd and Ashland; standing on Ashland Ave; possibly in front currency exchange",43rd and Ashland,ICE Sighting,,,,,,Paul,,,FSN,,
Park Ridge,9/5/2025 5:00pm,"09-05 Park Ridge-1775 Dempster St, Park Ridge, IL 60068",9/5/2025 5:00pm,Friday,8AM-4PM,,"FSN: ICE sighting today (9/5) and yesterday (9/4) at Lutheran General Hospital at Park Ridge, IL. Caller was scared to share more information other than ICE agents and Border Patrol were inside the hospital and walking around the hospital's public safety officers.","1775 Dempster St, Park Ridge, IL 60068",ICE Sighting,,,,,,Paul,,,FSN,,
Orland Park,9/5/2025 2:30pm,09-05 Orland Park-14200 S 82nd Avenue Orland Park,9/5/2025 2:30pm,Friday,8AM-4PM,,"ICE Sighting ??

Happened this morning in Orland Park Illinois. Location is approximately 14200 S 82nd Avenue Orland Park. Known community member was detained by ICE, was a DACA recipient. Reported that the person was walking toward his car when he was stopped by ICE agents. Only 1 person was detained from callers recollection. No pictures or video they can provide. Asked if someone can call them back with legal resources for the person detained. Call Back Number REDACTED and name was REDACTED.",14200 S 82nd Avenue Orland Park,ICE Sighting,,,,1,,Paul,,,RRT,,
Logan Square,9/5/2025 2:30pm,09-05 Logan Square-,9/5/2025 2:30am,Friday,4PM-12AM,,"Around 8:40 pm last night, two residents saw 5 men and one black SUV surround the Open Arms Community Church in Logan Square and try to get in. No agency names on their clothes or vehicles but they did have flashing red lights and the callers said it looked like they were training on how to break in. They are concerned about the church and are trying to reach them as well as trying to see if there is a camera recording to send us.",,Rumors,,Entering without consent,,,,Paul,,,FSN,,
"Maywood, IL",9/5/2025 1:55am,"09-05 Maywood, IL-290 W/B exit at 1st Ave.",9/5/2025 1:55am,Friday,4PM-12AM,,"6-7 Illinois State Police pulling people at random on the 290 W/B exit at 1st Av. No ICE presence seen. The officer directing traffic denied anything to do with ICE. One of our RRT was told “Roadside safety check that they’ve been doing for twenty years” Lieutenant Lavin, Illinois State Police who came up to them to explain what they were doing. Rep Hernandez is in our RRT Chat and will make a call to Illinois State Police legislative director tomorrow to get clarity on why they do them right now given everything that is happening. Team is clearing out now as did not see ICE nor see anyone detailed.",290 W/B exit at 1st Ave.,"False, ICE Sighting",,,PASO,,checked,Victoria,,,,,
Hermosa/Humboldt,9/4/2025 11:43pm,09-04 Hermosa/Humboldt-4250 W. Hirsch,9/4/2025 11:43pm,Thursday,4PM-12AM,,Reported ICE agents. 1 person detained in residential area. Reported agents wore generic vests and masks. License plates were P387665 and DP72165.,4250 W. Hirsch,"ICE Sighting, Home Raid",,,Chicago NWS,1,checked,Victoria,,,FSN,,
Humboldt/Hermosa,9/4/2025 10:32pm,09-04 Humboldt/Hermosa-North-Grand High School,9/4/2025 10:32pm,Thursday,4PM-12AM,,North-Grand High School went on lockdown due to a potential ICE sighting. CPS checked it out and couldn't find any suspicious vehicles.,North-Grand High School,"Rumors, ICE Sighting",,,,,,Victoria,,,,,
Orland Park,9/4/2025 10:16pm,09-04 Orland Park-135th and 85th Ave.,9/4/2025 10:16pm,Thursday,4PM-12AM,,Caller to FSN reported ICE activity near a home day care at the intersection mentioned above. New group with the Arab American Action Network checked out the sighting. There wasn't any agents around when the team showed up.,135th and 85th Ave.,"Rumors, ICE Sighting",,,Other,,checked,,,,FSN,,
Chicago - Southwest ,9/4/2025 8:17pm,09-03 Chicago - Southwest -56th and Pulaski ,9/3/2025 9:53pm,Wednesday,8AM-4PM,,"Rumor about ICE sighting due to FEMA workers surveying damage after the flooding. Aldermen Gutierrez shared the following: Teams from all the Emergency Management Agencies from the city, country, IEMA, and FEMA will conduct the damage assessment visits from Sept. 3- Sept. 7. Confirmed it is not ICE",56th and Pulaski ,"ICE Sighting, Rumors, False",,,Cicero/Berwyn,,checked,Stephanie G ,,,,,
Chicago - Irving Park ,9/4/2025 8:07pm,09-03 Chicago - Irving Park -3531 N Elston Chicago ,9/3/2025 9:29pm,Wednesday,8AM-4PM,,"FSN: There are two officers wearing gray pants and a blue shirts. They say ""cops"" in the back. Their car is gray, also an unmarked Explorer. They are ringing the doorbells. Confirmed it was all clear. ",3531 N Elston Chicago ,"ICE Sighting, Rumors",,,Chicago NWS,,checked,Stephanie,,,FSN,,
Albany Park,9/4/2025 8:04pm,09-04 Albany Park-Lawrence and Kimball,9/4/2025 8:04pm,Thursday,8AM-4PM,,Rumor was submitted via FSN by intern at the Impact Behavioral Health Partners that clients reported to their organization that folks were being stopped and asked for documentation. No one was arrested since they had their documentation.,Lawrence and Kimball,"Rumors, ICE Sighting",,,Chicago NWS,,checked,Victoria,,,FSN,,
Chicago -  Belmont Cragin ,9/4/2025 7:41pm,09-03 Chicago -  Belmont Cragin -4106 Willington Ave ,9/3/2025 9:26pm,Wednesday,8AM-4PM,,"ICE knocked on 4106 Willington Ave, they had military uniform, no was arrested",4106 Willington Ave ,ICE Sighting,,,Chicago SWS,,,Stephanie G,,,FSN,,
Evanston,9/4/2025 7:34pm,09-03 Evanston-Evanston CTA,9/3/2025 6:24pm,Wednesday,8AM-4PM,,"Seeing agents in the platform of CTA, information from YWCA, with no further information. Update from Evanston, there is no sign of ICE agents on any CTA platforms ",Evanston CTA,"False, ICE Sighting",,,Evanston,,,Stephanie G,,,,,
Chicago - The Loop ,9/4/2025 7:25pm,09-03 Chicago - The Loop -Monroe and Loomis ,9/3/2025 4:16pm,Wednesday,8AM-4PM,,"FSN: On Loomis and Monroe, a lady walking her dog is seeing agents gearing up with vest and mask on the parking lot of the police academy. ",Monroe and Loomis ,"ICE Sighting, Rumors, False",,,Other,,,Stephanie G,,,FSN,,
Chicago - Albany Park,9/4/2025 7:07pm,09-03 Chicago - Albany Park-Lawrence and Kedzie ,9/3/2025 5:34pm,Wednesday,8AM-4PM,,"Reporting of three agent sighting at Lindo Michoacan, no verification that it was ICE agents. ",Lawrence and Kedzie ,"ICE Sighting, Rumors",,,Albany Park,,,Stephanie G,,,FSN,,
Berwyn Cicero,9/4/2025 7:04pm,09-03 Berwyn Cicero-Cermak and Koster ,9/3/2025 3:33pm,Wednesday,8AM-4PM,,Tip about 60 agents in the sheriff building. It was confirm has nothing to do with ICE. but sheriffs involved. ,Cermak and Koster ,FALSE,,,Cicero/Berwyn,,checked,Stephanie G,,,,,
Chicago - Roseland ,9/4/2025 6:53pm,09-03 Chicago - Roseland -727 E 111st 60628,9/3/2025 3:13pm,Wednesday,8AM-4PM,,"FSN: US marshals with vest and plain clothes. its there Spanish speaker days when they have translators come in at the courthouse.  It was a false alarm, nobody was taken according to court staff. Marshals sometimes go to this courthouse to obtain documents from the judge. ",727 E 111st 60628,FALSE,,,Other,,checked,Stephanie G,,,FSN,,
Chicago - The Loop,9/4/2025 6:13pm,09-03 Chicago - The Loop-555 W Harrison ,9/3/2025 2:55pm,Wednesday,8AM-4PM,,"ICE located in the building, with at least three vehicles, three individuals identified. It was confirmed two arrest. The badge of one of the individuals pictured showed ""Tact 1 Security on Duty to Serve You, EST 2011"" The agents circled a couple of times, the attorneys inside and two employees of the courtyard there. From staff there: ""Apparently they arrested one women, and since then they drifted outside, then to the parking lot, and haven't seen them since"" ",555 W Harrison ,ICE Sighting,,,Other,2,checked,Stephanie G,,,FSN,,
Berwyn,9/4/2025 5:01pm,09-04 Berwyn-58th Ave. and Cermak,9/4/2025 5:01pm,Thursday,8AM-4PM,,"Rumor

IEMA (Illinois Emergency Management Agency) were present in the neighborhood to conduct flood surveys.",58th Ave. and Cermak,FALSE,,,Cicero/Berwyn,,checked,Victoria,,,,,
Chicago - Logan Square,9/4/2025 1:16am,"09-03 Chicago - Logan Square-2800 N. Milwaukee Ave., Chicago, IL 60647",9/4/2025 12:16am,Wednesday,4PM-12AM,,ICE and federal agents reported in Milwaukee-Diversey-Kimball intersection. RRT saw no agents upon arrival an hour after sighting. ,"2800 N. Milwaukee Ave., Chicago, IL 60647",Rumors,,,Chicago NWS,,,Marlyn,,,,,
Chicago - Loop,9/3/2025 11:38pm,"09-03 Chicago - Loop-328 S. Dearborn St., Chicago, IL 60604",9/3/2025 11:00pm,Wednesday,4PM-12AM,,"Officer and K9 dog spotted on Jackson Blue Line Subway station platform. RRT volunteer spoke with conductor, who said officer was there to reduce smoking and drinking. ","328 S. Dearborn St., Chicago, IL 60604",Rumors,,,Chicago NWS,,,Marlyn,,,,,
Chicago - Loop,9/3/2025 11:11pm,"09-03 Chicago - Loop-19 N. Dearborn St., Chicago, IL 60602",9/3/2025 11:10pm,Wednesday,4PM-12AM,,"Near Washington Blue Line CTA station. 2 agents were looking at cars. No interaction with anyone. Unmarked black vest, black cargo pants, and black shirt. ","19 N. Dearborn St., Chicago, IL 60602",Rumors,,,,,,Marlyn,,,FSN,,
Waukegan,9/3/2025 10:57pm,"09-03 Waukegan-Sunset Ave & N Lewis Ave, Waukegan, IL 60087",9/3/2025 10:57pm,Wednesday,4PM-12AM,,Plain clothes officer in a vest was spotted at intersection. Waukegan RRT was not able to confirm anything on site.,"Sunset Ave & N Lewis Ave, Waukegan, IL 60087",Rumors,,,Waukegan,,,Marlyn,,,,,
North Chicago,9/3/2025 10:24pm,"09-03 North Chicago-IL-137 & Martin Luther King Jr Dr, North Chicago, IL 60064",9/3/2025 10:20pm,Wednesday,4PM-12AM,,RRT member saw nothing. Verified as police. ,"IL-137 & Martin Luther King Jr Dr, North Chicago, IL 60064","Rumors, False",,,Waukegan,,,Marlyn,,,,,
Sugar Grove,9/3/2025 10:00pm,"09-03 Sugar Grove-Bliss Road, Sugar Grove, IL ",9/3/2025 10:00pm,Wednesday,4PM-12AM,,Report from RRT member's friend. Reported on marked black cyber truck with official logo on doors. ,"Bliss Road, Sugar Grove, IL ",Rumors,,,Aurora,,,Marlyn,,,,,
Chicago - Gage Park,9/3/2025 10:50am,"09-03 Chicago - Gage Park-S Mozart St & W 59th St, Chicago, IL 60629
",9/3/2025 10:10pm,Wednesday,4PM-12AM,,"Social media post. Three officials are shown in a photo wearing jeans, vests saying ""Police,"" unmasked. They stand near a red pick-up truck parked in the driveway of a residence. A different social media video was shared, where a Cook County Sheriff's vehicle can be seen. At least 10 officials in vests can be seen standing across two different houses' front lawns. ","S Mozart St & W 59th St, Chicago, IL 60629
",Rumors,,,Chicago SWS,,,Marlyn,,,,,
North Chicago,9/3/2025 2:12am,"09-03 North Chicago-Rosalind Franklin University, 3333 N Green Bay Rd, North Chicago, IL 60064",9/3/2025 2:00am,Wednesday,4PM-12AM,,"Rosalind Franklin University shares the campus with the Navy. They received an email stating the Naval Station is going to house the National Guard. No exact date was given, only saying this week through September 30. ","Rosalind Franklin University, 3333 N Green Bay Rd, North Chicago, IL 60064",Rumors,,,,,,Marlyn,,,FSN,,
Chicago - Loop,9/3/2025 2:09am,"09-02 Chicago - Loop-N Clark St & W Lake St, Chicago, IL 60601",9/2/2025 2:00pm,Tuesday,8AM-4PM,,Someone saw three ICE agents at Clark/Lake stopping people and checking IDs. ,"N Clark St & W Lake St, Chicago, IL 60601",Rumors,,,,,,Marlyn,,,,,
Wheaton,9/2/2025 8:49pm,"09-02 Wheaton-DuPage County Courthouse, 505 N County Farm Rd, Wheaton, IL 60187",9/2/2025 8:30pm,Tuesday,8AM-4PM,,"Sourced from a legislator and social media post that includes a photo of a white sedan with ""U.S. Customs and Border Protection"" label printed on side door. ","DuPage County Courthouse, 505 N County Farm Rd, Wheaton, IL 60187","Rumors, ICE Sighting",,,,,,Marlyn,,,,,
Chicago - Lakeview,9/2/2025 7:30pm,"09-03 Chicago - Lakeview-N Racine Ave & W Roscoe St, Chicago, IL 60657",9/3/2025 7:30pm,Wednesday,8AM-4PM,,4 men with matching navy blue polos waiting by an unmarked car. Men looked like they were waiting for something or someone.,"N Racine Ave & W Roscoe St, Chicago, IL 60657",Rumors,,,,,,Marlyn,,,FSN,,
Schiller Park,9/2/2025 7:25pm,"09-02 Schiller Park-4111 Mannheim Rd, Schiller Park, IL 60176",9/2/2025 7:18pm,Tuesday,8AM-4PM,,Unmarked white van with 3 men wearing CBP shirts at the BP Gas Station.,"4111 Mannheim Rd, Schiller Park, IL 60176",Rumors,,,,,,Marlyn,,,FSN,,
Hanover Park,9/2/2025 4:35pm,"09-02 Hanover Park-1525 W. Lake Street, Hanover Park, IL 60133",9/2/2025 4:30pm,Tuesday,8AM-4PM,,Gas station - 1 SUV car driving around in the parking lot. ,"1525 W. Lake Street, Hanover Park, IL 60133","Rumors, ICE Sighting",,,Hanover Park/Streamwood,,,Marlyn,,,FSN,,
Chicago - Lincoln Park,9/1/2025 8:30pm,09-01 Chicago - Lincoln Park-LSD and Fullerton,9/1/2025 8:00pm,Monday,8AM-4PM,,"Report from social media that there was law enforcement making people exit from LSD on Fullerton for a ""checkpoint."" ICIRR staff who were in the area went to check and didn't see any activity.",LSD and Fullerton,Rumors,,,,,,Peter,,,,,
