Chicago - Archer Heights,9/13/2025 12:22am,09-10 Chicago - Archer Heights-4716 S. Kostner,9/10/2025 6:15pm,Wednesday,8AM-4PM,,"Agents were knocking on doors. They’re in a gray jeep with tinted windows and additional information included ""I don’t see a jeep but this van did circle the block twice"" and ""One of my students who lives a block from there sent this but it’s from an hour - the picture is from Archer park - ppl said they were knocking on doors."" They could not confirm if ICE was there ",4716 S. Kostner,"ICE Sighting, Rumors",,,Chicago SWS,,,Stephanie G,,they’re in a gray jeep with tinted windows,RRT,,
Evanston,9/13/2025 12:18am,09-10 Evanston- Home depot- Border of Evanston and Skokie ,9/10/2025 6:20pm,Wednesday,8AM-4PM,,"fsn caller: Home depot truck that has been rented its parked on Drake and Church the border of Evanston and skokie two other trucks with out of state plates the Kentucky plates are K6j117 Chrysler 4X4 open bed truck Cali plates on the other truck dis not have the plates, Bessie Rhodes Grammer school k-8th only multilingual possible ice raid in the works caller said she saw& heard plain clothes men that look to her like agents no masks ,however heard a what seemed to be a conference call of sorts ,mention DHS and she heard them say dhs several times as well she stated that this grammer school is the only multilingual in the area and she has a feeling something is about to take place there, and wanted to give us a heads up. ", Home depot- Border of Evanston and Skokie ,"ICE Sighting, Rumors",,,Evanston,,,Stephanie G,, Kentucky plates are K6j117 Chrysler 4X4 open bed truck Cali plates on the other truck dis not have the plates,FSN,,
Chicago -  Garfield Ridge ,9/13/2025 12:16am,09-10 Chicago -  Garfield Ridge -5905 S Troy St,9/10/2025 6:08pm,Wednesday,8AM-4PM,,"FSN: 59th and Troy st, in front of apartment: 5905 S Troy St. 2 agents in a pickup truck silver tundra dark gray",5905 S Troy St,"ICE Sighting, Rumors",,,Chicago SWS,,,Stephanie G,, pickup truck silver tundra dark gray,FSN,,
Evanston ,9/13/2025 12:13am,09-10 Evanston -1703 Orrington ave.,9/10/2025 5:56pm,Wednesday,8AM-4PM,,FSN call : Another ice sighting by Howard red line. A coworker saw agents by the station about 10 minutes ago. I tried calling back to get more details but caller has not picked up. ,1703 Orrington ave.,"ICE Sighting, Rumors",,,Evanston,,,Stephanie G ,,,FSN,,
Chicago - Elsdon,9/13/2025 12:00am,"09-12 Chicago - Elsdon-53rd and Pulaski, 60632",9/13/2025 12:00am,Friday,4PM-12AM,,"3 black SUVs. One was a police van with six officers inside wearing black vests. 53rd and Pulaski, heading south.

East Chicago and SWS Chicago RRT shared that areas in the SW were full of police in the moment because of car caravans planned for the weekend. They were going to investigate. ","53rd and Pulaski, 60632",Rumors,,,"Chicago SWS, East Chicago",,,CE,,,FSN,,
Evanston ,9/12/2025 11:58pm,09-10 Evanston -1703 Orrington ave.,9/10/2025 5:56pm,Wednesday,8AM-4PM,,"FSN call :
Ice sighting by Evanston library. 1703 Orrington ave. 4 agents walking around with regular clothes but had officer gear. Caller was afraid and they walked away so they didn’t get to see a car or if any arrests were made. Agents are still there. From RRT member: We think that Evanston call was someone trolling. Please disregard. FSN getting an increasing amount of harassment calls",1703 Orrington ave.,"ICE Sighting, Rumors, False",,,Evanston,,,Stephanie G ,,,FSN,,
Indiana,9/12/2025 11:54pm,09-12 Indiana-,9/12/2025 1:00pm,Friday,12AM-8AM,,"For our collective records, we want to share here that SSIP did intake & support today for a Bolingbrook family— the father in law (Bolingbrook resident) is a delivery driver for Ashley Furniture & was pulled over in Indiana this morning by Indiana State Police, asked for proof of his immigration status and then arrested. A co-worker in the truck with him was also questioned then let go.

I registered the raid time as 7:00am but the report says morning.
",,Public Space Raid,,Pulling up cars,SSIP,1,checked,CE,,,RRT,,
Chicago - Belmont Gardens,9/12/2025 11:43pm,09-10 Chicago - Belmont Gardens-Parker & Kildare,9/10/2025 5:45pm,Wednesday,8AM-4PM,,"Someone just messaged RRT ""out on a walk in the Kelvin Park area (Parker & Kildare) we see a lot of ice agents parked on the street and circling the neighborhood like sharks. They’re driving late model vehicles with dark tints, you can tell they’re wearing vests and communicating via walkie talkies"" Palenque and NWS side responded. Can not confirm ICE agents but highly suspected. Nissan pick up and Dodge Challenger parked with masked agents, vehicles have left area. ",Parker & Kildare,"ICE Sighting, Rumors",,,Chicago NWS,,checked,Stephanie G,,,FSN,,
Melrose Park,9/12/2025 11:37pm,09-10 Melrose Park-Lake and 25th ,9/10/2025 5:24pm,Wednesday,8AM-4PM,,FSN: lake and 25th. That is all we got,Lake and 25th ,"ICE Sighting, Rumors",,,Melrose Park/Oak Park,,,Stephanie G,,,FSN,,
Chicago - Green Bay ,9/12/2025 11:00pm,"09-10 Chicago - Green Bay -8149 S Exchange Chicago, IL ",9/10/2025 5:07pm,Wednesday,8AM-4PM,,"FSN: ICE Sighting at 8149 S Exchange, they received 2 calls, 4 officers knocking on doors  a black Ford Explorer with license plate: 8292818. In addition: Message sent from a CPS teacher friend at Bowen high school school (89th and Marquette); he received it from a fellow CTU member around 11:40 AM. In response, Bowen is taking care with student dismissal today","8149 S Exchange Chicago, IL ","ICE Sighting, Rumors",,,Other,,checked,Stephanie G,, a black Ford Explorer with license plate: 8292818.,FSN,,
Chicago - Lincoln Square,9/12/2025 10:59pm,"09-12 Chicago - Lincoln Square-Wester and Irving Park, 60618",9/12/2025 10:59pm,Friday,4PM-12AM,,"Hearing there is/was a police helicopter over Irving park and western.
CPD said that they didn't have helicopters our at the time of the report. ","Wester and Irving Park, 60618",Rumors,,,Chicago NWS,,,CE,,,RRT,,
Evanston,9/12/2025 10:50pm,09-10 Evanston-1800 Block of Brown,9/10/2025 4:30pm,Wednesday,8AM-4PM,,"Another sighting in Evanston, confirmed federal agents, two black vehicles with tinted windows",1800 Block of Brown,ICE Sighting,,,Evanston,,,Stephanie G,,,RRT,,
Evanston ,9/12/2025 10:44pm,09-10 Evanston -Evanston Township High School ,9/10/2025 4:19pm,Wednesday,8AM-4PM,,"Federal Agents was parked outside Evanston High School (ETHS) at Church and in a Dodge, drove off when one of the team members knocked on the window (simply confirmed he was a federal agents) ETHS is running an evacuation drill at the moment. ",Evanston Township High School ,"ICE Sighting, Rumors",,,Evanston,,,Stephanie G,,"white jeep grand cherokee, IL plates 896 5936",RRT,,
Romeoville ,9/12/2025 10:40pm,09-10 Romeoville -261 S. Webber Road ,9/10/2025 4:10pm,Wednesday,8AM-4PM,, FSN: 261 S Webber road in Kohls parking lot in Romeoville in a white car in a green vest in a green shirt. Our team went to the location and surrounding businesses. We were not able to find the car from the tip.,261 S. Webber Road ,"ICE Sighting, Rumors",,,SW Suburbs,,checked,Stephanie G,,,FSN,,
Oak Lawn ,9/12/2025 10:35pm,09-10 Oak Lawn -Pavelion Centennial Park West Parking Lot ,9/10/2025 4:06pm,Wednesday,8AM-4PM,,FSN: Call indicating an armed body armor face mask truck has ILEAS Mobile Seals Force. Tinley Police Cars and unmarked police cars. The caller called back stating they are in training and not ICE. ,Pavelion Centennial Park West Parking Lot ,"False, ICE Sighting, Rumors",,,SW Suburbs,,checked,Stephanie G,,,FSN,,
Alsip ,9/12/2025 10:28pm,"09-10 Alsip -11535 South Cicero Alsip, IL",9/10/2025 4:00pm,Wednesday,8AM-4PM,,"FSN: Agents trying to get access to building, ","11535 South Cicero Alsip, IL","ICE Sighting, Rumors",,,SW Suburbs,,,Stephanie G,,,FSN,,
Calumet Park ,9/12/2025 10:28pm,09-12 Calumet Park -,9/12/2025 10:28pm,Friday,4PM-12AM,,"3 vehicles: One car and two SUV’s. 
One of them was an exact match as someone he saw on social media as an ICE agent. 
They detained someone earlier around 11 am. They were there again at around 2:25 pm. 
There was a large crowd and so they left.
The neighborhood chat was blowing up with sightings there so the RRT went to check. The RRT didn’t catch anything but they were able to track down people who posted videos and are trying to get details. By the end of the day, the RRT didn't have additional information. ",,"Rumors, ICE Sighting",,,East Chicago,,checked,CE,,,External,,
Hoffman,9/12/2025 10:10pm,"09-12 Hoffman-Graziano's Market close to Gold and Walnut, 60194",9/12/2025 12:45pm,Friday,12AM-8AM,,Facebook post that says that one person was taken by ICE. The car was blocking the driveway close to 7*11 on Walnut and Golf,"Graziano's Market close to Gold and Walnut, 60194",Rumors,,,,1,,CE,,"Gray, SH1474",External,,
Chicago - Pilsen,9/12/2025 9:46pm,"09-12 Chicago - Pilsen-1852 W 19th St, Chicago, IL 60608",9/12/2025 9:46pm,Friday,8AM-4PM,,Chat: Same car now in Pilsen by NMMA. ,"1852 W 19th St, Chicago, IL 60608",ICE Sighting,,,Pilsen,,checked,CE,,"Black, Jeep, LTZ1161, Texas. 2 men with vests (one reads ERO in the back and the pother one police in the chest). ",RRT,,
Chicago - Pilsen ,9/12/2025 8:45pm,"09-12 Chicago - Pilsen -Cermark and Western, 60608",9/12/2025 8:45pm,Friday,8AM-4PM,,the principal informed them to make the call. don't know exactly how many agents or cars,"Cermark and Western, 60608",FALSE,,,Little Village,,checked,CE,,,FSN,,
Chicago - Little Village,9/12/2025 8:18pm,"09-12 Chicago - Little Village-Rockwell and 19th, 60608",9/12/2025 8:18pm,Friday,8AM-4PM,,"confirmed 3 vehicles with agents outside speaking with DHS vest.
","Rockwell and 19th, 60608",ICE Sighting,,,Little Village,,checked,CE,,,RRT,,
Chicago - Little Village ,9/12/2025 7:48pm,"09-12 Chicago - Little Village -Trumbull and 26th St, 60623",9/12/2025 6:48pm,Friday,8AM-4PM,,"Possible ICE sighting on Trumbull and 26th St. They have been there for over 1 hour.
Two men sitting in the car. ","Trumbull and 26th St, 60623",ICE Sighting,,,Little Village,,checked,CE,,"Mazda SUV with lic plate TCT5735. It is a Virgina lic plate. 
They left a little bit after the person from the RRT arrived. ",FSN,,
Chicago - Little Village,9/12/2025 7:24pm,"09-12 Chicago - Little Village-Esperanza Health centers on 21st and California, 60608",9/12/2025 7:24pm,Friday,8AM-4PM,,,"Esperanza Health centers on 21st and California, 60608",FALSE,,,Pilsen,,checked,Claudia ,,,External,,
Chicago - Uptown,9/12/2025 6:19pm,"09-12 Chicago - Uptown-ACE Store: 3921 N Sheridan Rd, Chicago, IL  60613",9/12/2025 6:19pm,Friday,8AM-4PM,,"The ICE members were at the ACE store. A RR members mentioned that there was a distribution center nearby.

Confirmed ICE was in the store, bought something and left. The RR team gave KYR info to employees and folks at the food distribution nearby","ACE Store: 3921 N Sheridan Rd, Chicago, IL  60613",ICE Sighting,,,Uptown,,checked,Claudia,,"Ford Expedition, white, Illinois, 371327",RRT,,
Chicago - Little Village,9/12/2025 6:07pm,"09-12 Chicago - Little Village-2646 W Cermak, 60608",9/12/2025 6:07pm,Friday,8AM-4PM,,Just got a call from the wife of one of the jornaleros who’s a part of the Home Depot lawsuit. He was just detained while parked at 2646 W Cermak at what seems to be a targeted detention. Our Day Laborer organizer is on his way to provide support to his wife who witnessed everything and was left in the car. Our lawyers are making calls right now to get him representation and figure out where they have him. His wife Mary would appreciate additional moral support if someone in the area can also show up.,"2646 W Cermak, 60608",Public Space Raid,,,"Little Village, Pilsen",1,checked,Claudia,,"2 black corollas, no warrants, 6 agents + more inside car. 
Texas plates 
Black jeep Cherokee",RRT,,
Franklin Park,9/12/2025 6:01pm,"09-12 Franklin Park-Grand and Elder by a library, 60131",9/12/2025 3:00pm,Friday,8AM-4PM,,"Caller reports ICE chasing vehicle and there was a car crash. ICE detained driver and is still at the scene. At least 3 possible ICE agents, some wearing police vests while others are wearing unmarked Black vest. 

A RR member talked with neighbors who said that the shooting happened closer to 9:00am. 

Semi Truck from Battaglia: P1269712","Grand and Elder by a library, 60131",Public Space Raid,,Pulling up cars,Melrose Park/Oak Park,,checked,Claudia ,,,FSN,,
Chicago - Little Village,9/12/2025 5:54pm,"09-12 Chicago - Little Village-2646 W Cermak Rd, Chicago, IL 60608",9/12/2025 5:54pm,Friday,8AM-4PM,,,"2646 W Cermak Rd, Chicago, IL 60608",FALSE,,,Little Village,,checked,Claudia ,,,RRT,,
Broadview,9/12/2025 5:47pm,"09-12 Broadview-S 24th Ave & Fillmore St, 60155",9/12/2025 4:47pm,Friday,8AM-4PM,,"video says: ICE truck, half hour been at the corner of 24th and Filmore. More cars are coming with more people in uniform
About 5 people. Initially, there is a dark green card with two people in uniform. Less than a minute later, a second car (black) arrives with more people in uniform. ","S 24th Ave & Fillmore St, 60155",Rumors,,,,,,Claudia ,,,External,,
Chicago - Downtown,9/12/2025 5:18pm,09-10 Chicago - Downtown-Clark and Lake Blue Line ,9/10/2025 3:40pm,Wednesday,8AM-4PM,,"FSN: Clark and Blue line stop, 3 agents in the platform area. ",Clark and Lake Blue Line ,"ICE Sighting, Rumors",,,Other,,,Stephanie G,,,FSN,,
Chicago - Lawndale ,9/12/2025 5:18pm,"09-10 Chicago - Lawndale -3860 W. Ogden Avenue Chicago, IL 60623 ",9/10/2025 5:30pm,Wednesday,8AM-4PM,,"FSN: potential ICE agents outside 3860 W. Ogden Avenue | Chicago, IL 60623 Lawndale Christian Health Center not much other details provided as it was a voicemail received for call back. ICE was seen on Hamlin 
Worker at LC asking around for documentation around 11am. ","3860 W. Ogden Avenue Chicago, IL 60623 ",ICE Sighting,,,Chicago SWS,,checked,Stephanie G,,,FSN,,
Chicago - Midway,9/12/2025 5:15pm,"09-12 Chicago - Midway-Sahs School 50th and Long, 60638",9/12/2025 4:50pm,Friday,8AM-4PM,,,"Sahs School 50th and Long, 60638",Rumors,,,Chicago SWS,,checked,Claudia ,,,External,,
Chicago - Downtown,9/12/2025 5:14pm,09-10 Chicago - Downtown-Grand Red Line - Downtown ,9/10/2025 3:31pm,Wednesday,8AM-4PM,,The loop area there is a one agent with vest on the platform,Grand Red Line - Downtown ,"ICE Sighting, Rumors",,,Other,,,Stephanie G,,,FSN,,
Evanston,9/12/2025 5:14pm,"09-12 Evanston-Dodge Avenue and Church Street, 60201",9/12/2025 5:14pm,Friday,8AM-4PM,,"Caller reporting possible ICE agent pulled over a vehicle with TX license plate, they are speaking to a woman that appears to be Hispanic. Caller said looked like an ICE agent, and was in a brown SUV car. ","Dodge Avenue and Church Street, 60201",FALSE,,,Evanston,,checked,Claudia,,Brown SUV ,FSN,,
Chicago - Midway,9/12/2025 5:10pm,09-10 Chicago - Midway-5220 south pulaski road cermak produce ,9/10/2025 3:26pm,Wednesday,8AM-4PM,,ICE just arrived at the parking lot. One of the RR members called the employee at the store and said they have not seen anything. ,5220 south pulaski road cermak produce ,"ICE Sighting, Rumors",,,Chicago SWS,,checked,Stephanie G,,,FSN,,
Humboldt Park ,9/12/2025 5:08pm,"09-13 Humboldt Park -North and Cicero, 60639",9/13/2025 1:37am,Saturday,4PM-12AM,,"Time wasn't confirmed. 
About 4 -6 people with brown uniforms, mask, and brown vest (police) 
They were in an ally. 
About a minute after the person started to record them, they left. ","North and Cicero, 60639",ICE Sighting,,,SW Suburbs,,checked,Claudia ,,"Truck, Ford, Black, TGH6365, Texas
Jeep, Black, LTZ1161, Texas
Ford, Red 3686112B (in the video it is not 100% clear if this car was part of ICE group) 
Subaru, Grey, TGL3288

",RRT,,
Bensenville,9/12/2025 5:00pm,09-10 Bensenville-529 Thomas Drive lake ,9/10/2025 3:00pm,Wednesday,8AM-4PM,,"FSN: A cable company, ICE is outside of the factory, many business in that location and they are going to each one. Reports blocks away from the Thomas address initially reported, images on social media show agents circulating Midwest Distribution 1001 Foster Ave. RR Member arrived at location and there was another press event, unclear what occurred, but Nazi influencer (Ben Bergquam) was present, with armored truck. ",529 Thomas Drive lake ,"ICE Sighting, Rumors, Worksite Raid",,,Other,,,Stephanie G, Midwest Distribution 1001 Foster Ave.,,FSN,,
River Forest,9/12/2025 4:58pm,"09-11 River Forest-Close to North Avenue and Harlem Avenue, 60305",9/11/2025 8:30pm,Thursday,8AM-4PM,,"Neighbors from River Forests contacted to the RR team to inform of the kidnapping of two people. The RR temas has been in touch with the family. On September 12, a member from the RRT confirmed the abduction in the Activity Report chat","Close to North Avenue and Harlem Avenue, 60305",Public Space Raid,,,PASO,2,checked,Claudia ,,,RRT,,
Chicago - Back of the Yards,9/12/2025 4:48pm,09-10 Chicago - Back of the Yards-1757 W 48th St.,9/10/2025 2:52pm,Wednesday,8AM-4PM,,"From the BPNC chat & FSN: Safe Passage Team is reporting two gray Chevy vans since 7:20am. They are suspicious with dark windows, possibly ICE, plates AR 63065 and WA 85419",1757 W 48th St.,"ICE Sighting, Rumors",,,Chicago SWS,,,Stephanie G,,AR 63065 and WA 85419,FSN,,
Chicago - Downtown,9/12/2025 4:43pm,09-10 Chicago - Downtown-State and Lake Red Line ,9/10/2025 2:48pm,Wednesday,8AM-4PM,,"ICE present 6 agents, RR member was by state and lake and saw two police vest with plain clothes. The red line platform looks clear. ",State and Lake Red Line ,"ICE Sighting, Rumors",,,Other,,,Stephanie G,,,RRT,,
Bensenville ,9/12/2025 4:34pm,09-10 Bensenville -York Rd and Foster Ave. ,9/10/2025 2:28pm,Wednesday,8AM-4PM,,"FSN: surrounding a warehouse calls Midways Distributions, they have jeeps, pickup trucks and minimum of four vehicles.",York Rd and Foster Ave. ,"ICE Sighting, Rumors",,,Other,,,Stephanie G,,,FSN,,
Franklin Park ,9/12/2025 4:29pm,"09-12 Franklin Park -near 25th and Grand avenues, 60131",9/12/2025 4:00pm,Friday,8AM-4PM,,"1 person killed by ICE at a traffic stop in Franklin Park, IL 
This was first reported by an external person through the SW team and then got confirmed by the SW Suburb RR team. ","near 25th and Grand avenues, 60131",Public Space Raid,,,SW Suburbs,,checked,Claudia ,,,External,,
Chicago - West Lawn,9/12/2025 4:24pm,"09-10 Chicago - West Lawn-64th and Kolin, zipcode 60629",9/10/2025 2:22pm,Wednesday,8AM-4PM,,FSN: A teacher called that a parent called her saying ICE is by Lee Elementary School. RRT member arrived and did not see anything. CPS is following up with the school because there has been no report via that route. ,"64th and Kolin, zipcode 60629","ICE Sighting, Rumors",,,Chicago SWS,,,Stephanie G,,,FSN,,
Chicago -  Avondale ,9/12/2025 4:19pm,09-10 Chicago -  Avondale -Elston and Addison,9/10/2025 2:16pm,Wednesday,8AM-4PM,,"In Avondale, firestone tire, One CPD and once ICE car waiting for the shop to open ",Elston and Addison,"Rumors, ICE Sighting",,,Chicago NWS,,,Stephanie G,,,FSN,,
Chicago -  Hyde Park,9/12/2025 4:15pm,09-10 Chicago -  Hyde Park-64th and Woodlawn ,9/10/2025 2:15pm,Wednesday,8AM-4PM,,"Parked in front of a church, the church had been known to have MAGA folks engaging. Illinois LP: EA63551 Buick ",64th and Woodlawn ,"Rumors, ICE Sighting",,,Hyde Park/Woodlawn,,,Stephanie G,, Illinois LP: EA63551 Buick ,RRT,,
Harvard,9/12/2025 4:10pm,"09-12 Harvard-11 Frisco Drive, 60033",9/12/2025 3:10pm,Friday,8AM-4PM,,Sighting of ice in this location they have been parked there for more than an hour with computers in their car. But the person didn’t remember information about the car,"11 Frisco Drive, 60033",Rumors,,,McHenry,,,Claudia,,,FSN,,
Gurnee,9/12/2025 4:02pm,09-10 Gurnee-6600 grand ave,9/10/2025 1:40pm,Wednesday,12AM-8AM,,FSN: Several ICE agents at the home depot. Responder reports no activity in the area and store employee said it's been a quiet morning. ,6600 grand ave,"ICE Sighting, Rumors",,,Other,,checked,Stephanie G,,,FSN,,
Chicago - Midway,9/12/2025 3:59pm,"09-12 Chicago - Midway-7500 S. Pulaski Rd. Chicago, IL 60652",9/12/2025 2:00pm,Friday,8AM-4PM,,"Caller reported seeing multiple vehicles w/ MI, TX, WI, IL plates in the faculty’s parking lots. saw 4/5 men who came out of vehicles w/ luggage who walked toward vacant temporary buildings. No clear signs as to why individual thought they were ICE other than the sighting being out of the norm

In the chat, another RR team member highlighted that someone said earlier in the week that there was going to be increased presence of CPD in Daley College for a training in preparation for Mexican Independence day. ","7500 S. Pulaski Rd. Chicago, IL 60652",FALSE,,,,,,Claudia,,,FSN,,
Cicero ,9/12/2025 3:54pm,"09-10 Cicero -1400 S 58th Ct Cicero, IL ",9/10/2025 11:31am,Wednesday,12AM-8AM,,"Tip at Cicero church, a pastor has been arrested, multiple team members on their way: Message from a congregation member. Vehicles were Black Nissan pickup, gray silver infiniti, black jeep cherokee, black ford explorer, silver ford explorer.  15 agents were present with HSI vest, Joram Nunez, the pastor. Is expected to be presented later in the Northern District of Illinois. ","1400 S 58th Ct Cicero, IL ","Rumors, ICE Sighting",,,Cicero/Berwyn,,,Stephanie G,,,RRT,,
Hoffman Estates,9/12/2025 3:33pm,09-12 Hoffman Estates-750 N Salem. 60169,9/12/2025 3:00pm,Friday,8AM-4PM,,Van and another unmarked car have been driving around the parking lot all morning. Apartment office also sent notice to residents. No pictures taken and no details of cars,750 N Salem. 60169,Rumors,,,,,,Claudia Espinel ,,,FSN,,
Aurora,9/12/2025 3:23pm,"09-12 Aurora-Indian trail and 59th. In front of studio 41 , and McDonald.",9/12/2025 3:23pm,Friday,8AM-4PM,,10 ICE Agents are getting ready on route. One wearing mask. ,"Indian trail and 59th. In front of studio 41 , and McDonald.",Rumors,,,,,,Claudia ,,,FSN,,
Cicero,9/12/2025 3:15pm,09-12 Cicero-2805 S Kenneth. 60623,9/12/2025 3:15pm,Friday,8AM-4PM,,"The person who sent the text message wrote that there were about 9 of them. 
A RR team member wrote: ""Vehicle in the picture is the same SW ran off yesterday on 53/Kostner.""
Another RR team member noticed that: ""Same from the video where agent was putting together some sort of rifle/arm""
When the RR team member arrived the car wasn't there anymore. ",2805 S Kenneth. 60623,Rumors,,,SW Suburbs,,,Claudia Espinel,,,External,,
Chicago - West Loop,9/12/2025 3:00pm,09-12 Chicago - West Loop-Metra Ogilvie Stattion. 60661,9/12/2025 2:30pm,Friday,8AM-4PM,,ICE sighting at Metra Ogilvie Station. 6 ice agents in vests waiting outside. Waiting for people to come out,Metra Ogilvie Stattion. 60661,Rumors,,,,,,Claudia Espinel,,,FSN,,
Chicago - Humboldt Park ,9/12/2025 2:50pm,09-11 Chicago - Humboldt Park -Social Security Office ,9/11/2025 3:00pm,Thursday,8AM-4PM,,Immigration lawyer sent this. Went to the social security office with a client today and DHS was waiting outside. Recommend accompanying clients to these appointments at federal locations. The lawyer said: “It’s a really easy soft target because people NEED their socials and they are forced to go to these appointments at Federal locations: ,Social Security Office ,ICE Sighting,,,SW Suburbs,,,Claudia Espinel ,,,RRT,,
Chicago - West Elsdon,9/12/2025 2:30pm,09-12 Chicago - West Elsdon-60629. 57th place and Springfield Avenue. Right outside Peck Elementary School ,9/12/2025 1:00pm,Friday,12AM-8AM,,,60629. 57th place and Springfield Avenue. Right outside Peck Elementary School ,Rumors,,,Chicago SWS,,,Claudia Espinel,,"Black suburban , estrange license plate. 
",FSN,,
Chicago - Ukrainian Village,9/12/2025 2:30pm,09-12 Chicago - Ukrainian Village-Tri-Taylor area. Intersection of Hubbard and Campbell right off of Grand. 60612,9/12/2025 1:30pm,Friday,12AM-8AM,, ICE arrest in the Tri-Taylor area around 7:45 am today (intersection of Hubbard and Campbell right off of Grand). ,Tri-Taylor area. Intersection of Hubbard and Campbell right off of Grand. 60612,Rumors,,,Chicago NWS,,,Claudia Espinel,,Two vehicles with TX license plates: one black SUV+ one white SUV w/ license plate TGL3288.,FSN,,
Cicero,9/12/2025 1:30pm,09-12 Cicero-Cicero y la 45-44 to 63,9/12/2025 1:00pm,Friday,12AM-8AM,,"Lots of agents are stopping vehicles on 44th/45th, be careful",Cicero y la 45-44 to 63,Rumors,,,,,,Claudia Espinel ,,,External,,
Chicago - La Villita,9/12/2025 1:30pm,09-12 Chicago - La Villita-27 entre Homan y Trumbull,9/12/2025 12:30pm,Friday,12AM-8AM,,ICE stopped two cars ,27 entre Homan y Trumbull,ICE Sighting,,,Chicago SWS,,checked,Claudia Espinel ,,Ford de bates gris y una explore negra ford,RRT,,
Cicero,9/12/2025 1:30pm,09-12 Cicero-45th and Cicero. 60632,9/12/2025 12:30pm,Friday,12AM-8AM,,"A neighbor informed the RR member, saying it is their family member from Cicero.",45th and Cicero. 60632,Public Space Raid,,,SW Suburbs,1,checked,Claudia Espinel,,,RRT,,
Chicago - La Villita,9/12/2025 12:30pm,09-12 Chicago - La Villita-27th and Homan,9/12/2025 12:30pm,Friday,12AM-8AM,,,27th and Homan,Rumors,,,Little Village,,,Claudia Espinel ,,,External,,
Chicago - West Elsdon,9/12/2025 12:30pm,09-12 Chicago - West Elsdon-59th and Lawndale,9/12/2025 12:30pm,Friday,12AM-8AM,,,59th and Lawndale,Rumors,,,Chicago SWS,,,Claudia Espinel ,,,External,,
Cicero,9/12/2025 12:30pm,09-12 Cicero-Home depot: 29th/28th street. Zip code: 60804,9/12/2025 12:30pm,Friday,12AM-8AM,,,Home depot: 29th/28th street. Zip code: 60804,FALSE,,,SW Suburbs,,,Claudia Espinel,,,FSN,,
